\set ECHO none
add_provenance

(1 row)
create_provenance_mapping

(1 row)
count
5
(1 row)
probability_evaluate
1
(1 row)
create_provenance_mapping

(1 row)
count
6
(1 row)
probability_evaluate
0
(1 row)
probability_evaluate
1
(1 row)
create_provenance_mapping

(1 row)
count
8
(1 row)
probability_evaluate
0
(1 row)
probability_evaluate
0
(1 row)
probability_evaluate
0
(1 row)
probability_evaluate
1
(1 row)
create_provenance_mapping

(1 row)
count
11
(1 row)
value|probability_evaluate
1|0
2|0
3|0
4|0
5|1
6|0
7|0
8|1
12|1
13|1
14|1
(11 rows)
query
UPDATE update_test SET id = 6 WHERE id = 1;
UPDATE update_test SET id = 7 WHERE id = 1;
UPDATE update_test SET id = 8 WHERE id = 6;
UPDATE update_test SET id = id + 10 WHERE id >= 2 AND id <= 4;
(4 rows)